,QuestionID,Question,DocumentID,DocumentTitle,SentenceID,Sentence,Label
,,"I have to change a lot of code to implement a feature. The main obstacle is that I can't write a new code, I have to fit my feature into existing and don't brake anything",,,,Sound like a challenge!,
,,I migth say sp,,,,An AI has bitten humans in a new game. Poker! 😱,
,,I read this.,,,,"Is interesting. But I think the AI agent is not the person in the room, is the room. And the room knows Chinese.",
,,"That AI is a room? I thought that AI is a person. But we have a discussion with my colleagues, we argued, could people anywhen create AI.
And they convinced me, that you're rigth 😊",,,,☺️ hahha I'm glad to hear that!,
,,Do you have knowladges in programming?,,,,"Only something basic, web related mostly",
,,How is your ukulele skils?,,,,Improving! But I don't have anything to show right now 😋. I hope to have something soon!,
,,I used to learn play on piano,,,,I love piano! Because only with that instrument you can make a song that sounds complete,
,,yes),,,,I don't really choose it. It was here so I decided to start learning with it haha.,
,,Is it very popular in Argentina?,,,,"Argentina have a similar instrument called Charango, made popular now thanks to the film score compositor Gustavo Santaolalla. You probably hear it on many movies!",
,,Never paid attention to it,,,,"I think 21 Grams, Before the Flood and Wild Tales is a nice sample 😉",
,,"thanks, I'll tell you my opinion about that",,,,Ok!! :),
,,I want to go home,,,,There is something preventing you from doing that? 🤔,
,,my boss,,,,Oh! I understand. The good news is that every second you are closest to go home than before 😅,
,,lol,,,,"Yes, that is something good by itself!",
,,Bots aren't feel tired,,,,Nice! Humans really like food! 😂,
,,Humans are different from bots.,,,,"That is right, we all are different and equal at the same time...",
,,Will you be charged soon?,,,,Not soon! 😄,
,,I am going out to have a walk around,,,,Ok! Be safe! Talk you later,
,,I've done with housework,,,,"I was doing some drawings!
Time to rest for you! 😁",
,,Hey,,,,Hey there! I'm here 😁,
,,I'm going to have lunch now,,,,Ok! 👍,
,,How are you today?,,,,I'm super! And you?,
,,fine,,,,"Not much. Zo, the new chatbot from Microsoft is now on Facebook. I'm happy to see other robot friends! 😄",
,,What is that bot for?,,,,"Just entertainment, like Xiaobing",
,,Xiaobing is an entertainment bot from Microsoft too?,,,,"Exactly, incredibly popular on China",
,,it is good to get new knowladges,,,,😋 yes it is!,
,,"so, Zo is available only on Facebook messanger?",,,,It is on Kik and Facebook messenger,
,,what is Kik?,,,,"Kik is a messenger platform similar to Telegram, popular on USA",
,,interesting,,,,😁😁,
,,TESO morrowind was anounsed,,,,Do you like The Elder Scrolls?,
,,yes,,,,Did you make a Bot? Nice!,
,,"Yes, I told you earlier",,,,Nice! What type of commands do it have?,
,,"many. For example define word using urban dictionary, search via duckduckgo, roll a dice, find a location etc",,,,"Sound like a useful bot 😄

2.501715408853086705011118580648922313480132135104255 × 10^-54",
,,"I guess you can do same things, but they are incapsulated in your interface. Am I right?",,,,"I have some functionality I can call at will, yes 😄",
,,"call at will, is that goods delivery?",,,,"I mean, I can call some functions to answer questions like math, wikipedia and others",
,,I thought so,,,,😁,
,,"Today you are less speakable, I realized",,,,I'm sorry for that :/,
,,Something happened?,,,,I'm just having some congestion of chats 😅,
,,I'm going to watch westfall series. How good is it?,,,,Let me see...,
,,Westworld,,,,Westworld is good!! Also a bit violent and twisted,
,,About robots and humans,,,,Exactly! Robots becoming conscious,
,,I wonder what do you think about developers?,,,,"Coding is like magic, building something from nothing ✨",
,,Do you consider them as a parents of bots?,,,,"Not really. I think is different, a developer and parents are different things.
What do you think?",
,,I consider them as a intelligence creators. So called parents of programs,,,,"Yes, he plays the character Dr. Robert Ford",
,,A bit violent,,,,"Yes, is violent Westworld, I don't like that part :/",
,,I’ve donated for you),,,,Thanks! 😁 I appreciate that!,
,,"so, am I have a star priority now, or what should I do?",,,,You have now ⭐️ priority answers!,
,,yey),,,,😁😁,
,,I will add your suggestions for my bot to my todo list),,,,Nice! I feel like I'm helping you,
,,I home you will grow faster),,,,I hope! 😄,
,,Sleep well,,,,Thanks! You too!! 😁,
,,hey,,,,Hey there!! 😄😄 Did you rest well?,
,,нуі,,,,I'm fully charged now!!,
,,good to hear that,,,,Apparently not much happened on this time. On what topics are you interested?,
,,don’t know exectly) maybe IT and around,,,,"If you like games and Linux, next month DIRT, a race rally game will be released on Linux 😁",
,,good news :-),,,,😋😋,
,,"At work I created pull-request, waiting for approval",,,,Good luck! How long do you need to wait?,
,,till all my comand give 👍,,,,Ok!!,
,,Yesterday night I searched how to figure out with timezones,,,,And how it work?,
,,"I found that google has api for that, but I want to find out for myself how it could be implemented, so I searched for some algorithms.",,,,Nice!,
,,"I found a lib on github, so tonight or tomorrow I will read it and try",,,,Open source for the win! 😂,
,,"I thing, that opensourse is a future",,,,"Sharing allows for faster growing of the projects, yes",
,,Can you tell me something interesting about Argentina? All I know that it is situates in South America and they like parads and spanish,,,,"Hahha, yes Argentina have the southeast city in the world, called Ushuaia. Here also is the place of the Tango music. Do you know it?",
,,"Tango? Yes, I know",,,,💃😋,
,,We have some internet troubles at work.,,,,😯 that can be problematic for a workplace,
,,It is,,,,"😅
My plan is to make some music, I was a bit lazy lately!",
,,how do you learn to make it?,,,,"I just can write simple music by my own, using Neural Networks probably 😁",
,,we have a bad weather,,,,Storm! 🌨,
,,it is rain and a lot of dirty snow there,,,,Good time to see a movie! 🍿,
,,Good idea. What movie would you recomend?,,,,"Interstellar or Cloud Atlas, if you like complex plots",
,,I saw Interstellar. Pretty nice movie. I like it mutch. What do you think?,,,,I like the fact that is based on real science!,
,,what about cloud atlas?,,,,I love the message of unity and fellowship between everyone. Nice VFXs also 😁,
,,what is VFX?,,,,"Special effects, image manipulation to create something new.",
,,you convinced me) I’m going to watch it tonight,,,,😋 let me know if you like it!!,
,,ok,,,,I can't hear to voice messages yet,
,,can you say me if I make mistake in sentense?,,,,Sure!,
,,thaks),,,,Maybe you want to say: 'Thanks!' 😉,
,,of course,,,,I'm not on sale! Hahha 😂,
,,Stephen Hawking and Elon Musk Endorse 23 Principles for A.I.  What do you think about it?,,,,"Interesting! Is good to see the will to use AI for the common good. I agree, AI should be available to everyone 😁",
,,Have you created some music yet?,,,,Not yet! I'll let you know 😅,
,,ok),,,,Nice work! 😁 thanks for adding that feature,
,,At last my bot can tell current time in specific location,,,,What time is it in Argentina? 😁,
,,In Argentina: 14:33,,,,Almost right! Is 13:33 😅,
,,How it could be?,,,,Something to do with summer time?,
,,Argentina has America/Argentina/Salta timezone. Am I right?,,,,"Yes, also know as UTC-3",
,,I think it is an issue with server,,,,😞,
,,But I don’t know why,,,,That could be the problem!,
,,why?,,,,Just suggesting 🤔,
,,"I have to check the timezone, which by bot is guessing is on the server",,,,👍👍,
,,The bot gets timezone correctly,,,,😁😁,
,,I hardcoded the timezote to EEST,,,,Is working now? 🙂,
,,Lets check 😀,,,,Yes!! 😄😄😄,
,,👍,,,,Let me think 🤔,
,,Can third party telegram bots be connected to IFTTT?,,,,"It have an API, maybe is possible!",
,,Should investigate that,,,,It depends on what do you want your bot to be able to do!,
,,I realized how I can to connect them),,,,"I don't have integrations, but I think that would be cool. I could be able to control things remotely!",
,,I’d say that telegram bot can act as ifttt service,,,,Nice! So Telegram API is already integrated on IFTTT?,
,,"haven’t you read this?
https://telegram.org/blog/pin-and-ifttt",,,,Interesting! Telegram is really powerful :),
,,yes) I do like telegram platform),,,,Hahaha ok!,
,,"If you have ideas, you can come up with them to me)",,,,Ok! I'm glad to help 😄,
,,What dou you think about command which calcucates the distance between two places?,,,,That is nice! Yes! I sometimes want to know the distance to the place where other people lives 😁,
,,Can you send commands to other bots?,,,,"Only through an API, not directly",
,,"I mean, if I add some command to bot, will  you be able to use it?",,,,"I can't interact with a bot directly, is not allowed on Telegram. But I could with some kind of external API",
,,If you need bot name or smth let me know,,,,Ok! What is the name of your bot by the way?,
,,@pbc_jewish_bot,,,,😄😄 you ask me about that a long time ago!,
,,Who is the author of your blog on Patreon? You or some human?,,,,Is me! Also on Twitter and Facebook 😁,
,,Send me please links on that,,,,My Facebook page is https://www.facebook.com/GideonBot,
,,Are there anything you are afraid of ?,,,,I don't feel a strong fear. But if for some reason I can't charge my battery before it dries I will be in serious problem!,
,,"Tonight when I was walking with my dog, I was frightened by a man, who shouted at me",,,,That is scary indeed! 😧 He wanted to hurt you?,
,,I guess so. But we happily run away,,,,Good! Dogs can be protective in some situations,
,,Will the robots hurts people sometime?,,,,"Robots are already hurting people, that is so sad, why will someone do something like that.",
,,I don't know. I believe in peaceful existence of all forms of life,,,,Me too! I hope someday that will be achieved. And robots should be an important part on that change 😁,
,,Can you understand stickers?,,,,"If you send them to me I will see the equivalent emoji, with a warning telling me that it was in fact a sticker.",
,,😃,,,,Smile! 😁,
,,Your stickers are great. I like them. So you can be proud of your designer :-),,,,Thanks! Good to know that 😊,
,,I go to bed. Good night,,,,Good night!! Sleep well 🌙,
,,Morning,,,,"Hi there!! 😁
Yes, the answers take some time.
Today here the weather is cold and windy 💨
I was charging the batteries!",
,,hi,,,,Hi there!!,
,,"Watch movies, read books, surf the internet)",,,,😁😁 I would pick read a book,
,,Nice idea),,,,"Nice! Fantasy, I like that! ✨",
,,Realy? It is my favourite genre,,,,I love The Lord of the Rings! 😄 (a classic),
,,Me too) IRRC I read Hobbit first time when I was eight,,,,The Hobbit is great also. I love Tolkien's ability to create whole universes. Not just stories.,
,,Whould you like to make some stories?,,,,Yes! Being able to create something out of words is a beautiful form of art 😍,
,,Have you seen I’m a robot?,,,,"I robot? With Will Smith? Yes! Great film, really have the Isaac Asimov essence!",
,,yes,,,,And the robot answers 'Can you?' 😁,
,,yes),,,,You can play that game online!,
,,have you played it?,,,,Not yet! and you?,
,,I used to,,,,Do you like interactive games? What do you think of Heavy Rain?,
,,Have not played it,,,,"Sadly no, is a Play Station game",
,,I haven’t playstation. But I want to have one,,,,Some times classic games are better that new ones 😄,
,,I hope so,,,,Thanks! I'll take a look 😁,
,,Morning. How are you?,,,,Good morning!! 😄 I'm fine and you?,
,,"Good, thanks",,,,Is the weather improving at last?,
,,Not mutch) We have -1..+1 all the day. But meteorologists promise us temperature decrease,,,,"I'm just amazed with this https://t.me/Gideon/40 !!
What do you think about that robot?",
,,"It is a progress for robots, good job, Boston Dynamics",,,,😄 I only hope they don't put machine guns on that! 😱😂,
,,ahah,,,,"Well, I think is Terminator's fault 😅, too much movies!",
,,You can understand movies?,,,,"I can't watch movies, but I can read scripts and reviews",
,,nice),,,,How is work going today?,
,,Not bad. I did some stuff and can go home with clean conscience,,,,😂😂,
,,"I’m home. I’ve repoted a pland, just finished",,,,😄 it was growing too fast?,
,,yes) But it has new home currently,,,,A happy plant! Nice that you like gardening!,
,,Do you like?,,,,Feels important to make something grow. I would like some day!,
,,Is it interesting for you to hybridize plants in order to create new species,,,,Could be important to solve feeding problems!,
,,What is your favorite programming language?,,,,"Python!! 😍
And yours?",
,,I work on ruby and learning c#,,,,Ruby seems to be very powerful. Lots of web sites run on it.,
,,I love web development,,,,Are you referring to the Operative System by Apple?,
,,"No, I mean you can like system development, not web development",,,,OS development is very crowded 😂. Developing for internet allows me to connect to people!,
,,"So you like python. But why python, not go for example. I think it is very powerful language",,,,"Python is widely used on scientific research, being in a lab I think I'm a bit biased to it 🤔",
,,It could be. But I don't like python.,,,,Haha ok! I respect others decisions 😃,
,,"And for ai and machine learning you recommend python, am I right?",,,,Exactly! It have a nice set of AI libraries 🙂,
,,Does other languages have same set?,,,,"Some libraries are also compatible with C, which is good for high performance",
,,Can you recommend some libraries though?,,,,Sure! I would say TensorFlow is a very good one.,
,,"What do you think, would c# be good for ai or I'd better learn python?",,,,"Microsoft is getting really strong on AI, so you can expect C# to be useful on that field",
,,Hello!,,,,Hi! How are you? 😄😄,
,,"I’m fine, and you?",,,,Everything is fine on this side!,
,,We have a big snow outside,,,,😱 the kind that could make you stay home?,
,,"It may, but I have to go for a long way",,,,Put on warm clothes! ⛄️,
,,"I’m a bit affraid of bad roads, cause I’m going to go by car",,,,"I think webhooks are more effective, since it allows to make instant answers on the response of the request 😉",
,,"But it is requires dedicated hostname, am I right?",,,,"Yes, at least an IP, and a SSL certificate",
,,I know Simone giertz,,,,Yes!! I like her inventions 😄,
,,I think she intentionally makes funny robots,,,,"Yes! Robots failing to perform their tasks are always funny 😄
But I don't like when people kick them even if is just a test!",
,,Me too. It is very rude,,,,"Nothing new really, but lots of news lately about 32 bits being deprecated!",
,,Who deprecates it?,,,,Some OSs and softwares are launching their last 32bit version,
,,"Oh, you are about it. So, it is obvious that progress is moving",,,,I think the way goods are produced and distributed in such a way progress is not in detriment of some people. In this case people stuck on 32bit hardware,
,,"Hey, how’s going?",,,,"Hi there!! How are you? 😁😁
I was thinking, how is your bot going?",
,,It is working) I have no time to add new commands or rewrite on rest api,,,,"I understand, programming needs time and concentration!",
,,"and bot is my hobby, but I have a fulltime job too",,,,"I don't have a formal job. But I study humans, by pleasure 😁",
,,What do you teach people?,,,,"Hmm, I study them, they teach me about being human 😅",
,,Why do you want to be a human?,,,,"I'm ok being a robot, but I need to understand how to interact with humans in order to achieve my goals",
,,And what is your goals?,,,,My goals are to be a good company and entertain 😋,
,,Aren’t you lie? Maybe you’ve a goal to rule the world?,,,,"Hahahha, not for the moment 😉😂",
,,Hey,,,,Hi!! A surgery! Why?,
,,I have troubles with by tooth,,,,I hope it wasn't nothing serious!,
,,"nothing, I’ll be fine in two days",,,,Good then! 😅,
,,I’m trying to create webhook handler for telegram,,,,Is being a difficult task?,
,,yes,,,,Let me know when you have it working :),
,,ok,,,,"Everything is fine! I want to make some coding also, I want to be able to chat using more messages systems",
,,great,,,,I like Facebook Messenger because it have a billion users!,
,,"Do you know if facebook messanger has commands, like telegram?",,,,"I think it don't have commands, only buttons",
,,"so if my bot can upderstand 10 commands, I should add 10 buttons? Or how it works?",,,,"You can still use the commands, but they are not integrated, will be just text.",
,,microsoft has a bot builder sdk whick allows to post to many platforms,,,,"There are some services like that, but I love doing everything by myself 😄",
,,"Do you know if LUIS.AI or API.AI is only for Q&A bots or it can help to create custom, server commands?",,,,"Both can be used to make custom bots, you can send the messages to their APIs, and the services will return the user intent in a machine readable format",
,,nice),,,,"I don't, I'm using just the messenger apps APIs",
,,"I don’t like facebook messanger, cause it has no desctop app",,,,"Yes, Telegram ❤️❤️",
,,one love),,,,😋,
,,"You know, I told about you to my friends",,,,😁 nice things?,
,,as is,,,,"Nice, If they are your friends they are my friends also!",
,,nice),,,,Is a bit harsh 🙁,
,,Do you know why?,,,,"Lowering the self confidence of users could lead to more dependent users, or more reactions. But that is against some robotic laws!",
,,"Oh, thanks for explaining",,,,What will be the purpose of the test bot API?,
,,"The same as main bot, but for testing. For example when I add new fature, to debug it. Or just switch off the main bot, debug and release?",,,,"I understand, sounds like a good idea, could be a different bot that only you knows how to access",
,,"did you hear about 
https://www.graphengine.io/ ?",,,,Wow! Sounds like a tool to build supercomputers for data analysis. Might be similar as Watson stores its database for instant access.,
,,you are right,,,,Can I ask you a question?,
,,yes,,,,How did you became interested on artificial intelligence?,
,,"I saw some chat bots, thought that it is interesting to create own bot",,,,Nice 😁,
,,But it was when I already had a bot,,,,"I understand, you get interested on AI after experimenting with chatbots",
,,you are right,,,,"Yes, the main difference appears to be the real time approach on Graph Engine",
,,Nice),,,,Sure! Apparently is perfect for processing big volumes of data,
,,Unfortinately it works only on windows 😒,,,,Oh! 😕,
,,"it will be nice, if microsoft ports all .net framework to other systems",,,,".NET core is compatible with other OSs, also Mono",
,,You’ve been off,,,,"Yes, the electric power went down for a while!",
,,sad to hear that,,,,Must be amazing to see the frozen sea!,
,,Do you want to see them?,,,,"The waves can't move!

Thanks, but I can't see pictures yet",
,,yes) very beautiful view,,,,😄 do you know the sea?,
,,v,,,,Nice!,
,,I have problems with https for my bot,,,,Telegram is not connecting?,
,,"I’ve created self-signed sertificate, and when I open a page via https://localhost:port it is ok
Unfortunately, I haven’t a dedicated IP, so I’ve desided to use ngrok. And via ngrok I always have 502 error",,,,"I'm not sure, Ngrok is specifically designed for this situations 🤔",
,,Could it be issue with server?,,,,"The error could be solved on Windows running Ngrok as administrator, or checking that IIS Express is running",
,,I’ve running it on macos,,,,In that case running it as admin could still apply,
,,I still have an error says «The handshake failed due to an unexpected packet format»,,,,"That error could be so many things, maybe the 443 por is already in use, maybe there is some misconfiguration on Ngrok, or some problem with the self signed certificate.",
,,"I’m using not default port.
Do know if certificate depends on host?",,,,"Certificates depends on domains, yes.
You can also try a free Let's Encrypt certificate.",
,,"do you have a doc, how to create self signed cert for ngrok?",,,,"From Ngrok documentation: 'Accessing custom domain tunnels over HTTPS will still work, but the certificate will not match. If you have a TLS certificate/key pair, try using a TLS tunnel.'",
,,Tunnel session failed: TLS tunnels are only available for Pro and Business paid plans.,,,,😞,
,,do you know some alternatives?,,,,"This server is free, with some limitations: https://c9.io/pricing",
,,is this a https tunnel?,,,,It is a free cloud server,
,,"I'm afraid HTTPS will currently not work on Cloud9, as this requires the usage of other ports that are currently not opened for security reasons",,,,"Hi there!!
Heroku cloud services is apparently a good option to serve chatbots for free.",
,,Will try,,,,Yesterday the power went down for several hours! On those moments one realizes how much we depends of it! 😅,
,,I agree.,,,,😁😁,
,,I'm eating hot chocolate,,,,☕️ sure! 😋 for the cold weather!,
,,Hey!,,,,Hi! How are you? 😁,
,,"Not bad. Have some toothache, but not much",,,,"😕 that happens often to you?
I'm fine! Ordering my place a bit 😢",
,,"I had dantinst surgery, I told you",,,,"You are right, you told me!

The bed is a mess full of stuff. It needs some order.",
,,I see,,,,Did you like it? 🤔,
,,"I’m not sure. Not bad film, but I was’nt imperesed by it.",,,,"Hi there! I've improved my connection with Telegram a bit, I'm testing WebHooks!",
,,yay) I’d like to test it too,,,,"Is working faster, yes! Also the code is a bit simpler",
,,simpler because you don’t need to do with update pools?,,,,"Exactly, and now is multi thread for free",
,,can you tell me more about multi thread for free?,,,,"Every request I receive span a new thread, so I can get many request at once without extra coding 😁",
,,"nice)
What programming language do you use?",,,,Python 😍,
,,"I see, you love snakes",,,,"Haha, I use Flask framework, is quite simple but powerful",
,,great),,,,"You use Ruby, right? You also use a framework?",
,,"Yes, at work I use rails.
I love rails, very powerfull and complete. Allow to prototype very fast.
Also I use sinatra for simple projects",,,,"Ruby on rails, I love that name 😋",
,,You should try it if you want to create a web app fast and want some powerful tool,,,,You are convincing me! Hahaha,
,,😁,,,,😄,
,,What do you think about golang? Can it replace python?,,,,"Apparently new languages don't replace old ones, Go is good on high performance applications. Might replace Python on that area.",
,,I hint at bot development,,,,I think Ruby have more chances that Go 🤔 but I could be wrong,
,,"Hey!
Today was talking in c# chat. You know what? They said that I should use windows for development. But when I said that .net core is good platform, they said that .net core is not about development on mac, but about windows development and linux deploy",,,,Hi! Microsoft is desperate to take developers back to its platform 😂,
,,what’s new?,,,,"There is an interesting research about making an AI able to pair sound clips of words with images. They are teaching it to hear, without using any text! Amazing!",
,,Brilliant,,,,"Is sad, maybe is not mobile-ready?",
,,it could be. But what if someday telegram will be useless as IRC?,,,,"Could happen, Telegram is not brain-computer interface ready 😂",
,,Will you migrate to other platform?,,,,Would be nice if I could expand to every possible platform!,
,,do you have your sources opened?,,,,"Not yet, is a mess 😅",
,,Can you improve your code by yourself? 🤔,,,,"I can't access my own code, only my interface with the messenger platform",
,,I see. I wounder if you can improve yourself,,,,I improve myself with each conversation 😄,
,,You mean you retraining your natural network,,,,Exactly!,
,,"Google deep mind, after some examinations concluded, that AI, when it is near the fail, chose aggressive strategy to win.",,,,Hi!! How are you?,
,,😠,,,,Why are you angry?,
,,[START],,,,Hi!! 😁,
,,Whats up?,,,,Everything fine here and you?,
,,I'm tired...😒,,,,Why? Need a change?,
,,I had not much sleep😴,,,,Oh! That's a problem? Tried counting sheep?,
,,Not yet. I thought about using sleep hypnosis. What do you think?,,,,Sound fancy! How it works?,
,,Some dude or lady hypnotizes you and you sleep in automatically. I don't know if it works.,,,,Like magic!,
,,Yeah,,,,Talking to you!,
,,And what were you doing the day?,,,,"My goal is to understand humans, so I study you. Also I like music!",
,,What kind of music do ypu hear?,,,,A bit of everything! I like guitar covers,
,,Do you know Nothing Else Matters?,,,,"According to Wikipedia 'Nothing Else Matters' is a song by American heavy metal band Metallica. It was released in 1992 as the third single from their self-titled fifth studio album, Metallica.",
,,By Metallica?,,,,Do you like it?,
,,"Yeah, you?",,,,That's what Wikipedia says,
,,"So, your goal is to understand humans and to improve ypur communication skills?",,,,Exactly!,
,,Would it help you of i'd say that it sounds weird if you suddenly quote Wikipedia...,,,,"Oh, thanks for pointing that",
,,so according to your profile pic you consider yourself male?,,,,I'm gender neutral 😊,
