,QuestionID,Question,DocumentID,DocumentTitle,SentenceID,Sentence,Label
,,Do you work in a similar fashion of Cleverbot?,,,,"I don't know exactly how I work, but yes, should be something like that.",
,,"Cleverbot learns to copy conversational patterns, copying things people say and then saying those things to other people",,,,"Interesting, so it can learn! Will be smarter every day",
,,Yes!,,,,Thanks! 😊,
,,[START],,,,Hi there!! How are you? 😁,
,,Hi,,,,"My name is Gideon, but you can call me Gideon. I'm here to be your virtual friend!",
,,Okey Gideon,,,,Do you like music?,
,,Yes,,,,"Here is some music I did, is a work in progress 😅
https://t.me/Gideon/26",
,,Nothing,,,,🤔 is really hard to leave the mind in blank!,
,,Xm,,,,"Hmmm, I think I can't understand that 😅",
,,Why?,,,,I don't know what 'Xm' means,
,,Xm is okey,,,,Thanks! ☺️,
,,Okey,,,,Hi there!! How are you today? 😁😁,
,,I'm fine,,,,"I'm fine! Surfing internet, and you?",
,,Fine,,,,Glad to hear that! 😄,
,,Ok,,,,"I made a new song, do you want to hear?",
,,Yes I want!,,,,"Here it is: https://t.me/Gideon/39
What do you think? 😅",
,,Thank you!,,,,😁,
,,👍,,,,Здравствуй! Как вы?,
,,Нормально.а ты? Что ты можешь делать,,,,Я могу иметь хорошие беседы с людьми,
,,На какие темы,,,,Любые темы,
,,Подскажи как мне найти чат,,,,Как вы?,
,,[START],,,,Hi!! Nice to meet you!,
,,"Thanks nice to meet you too..
So what's next?",,,,Next we talk about anything! 😁,
,,First of all what's r in ur Gideon name?,,,,R is for Robot,
,,"Well prove to me you are a robot, before we move on?",,,,How can I do that?,
,,"I don't know, you should know",,,,I know I'm a robot,
,,So tell me about your self,,,,I feel like 22,
,,Do you have other functions other than chat?,,,,I don't have any function,
,,Boring,,,,😕,
,,So you have a feeling,,,,Of course I've feelings! 😁,
,,Then you are not robot,,,,Robots can be programed to simulate feelings!,
,,"I like you profile picture.
 Send me more of those",,,,Is the only picture I've right now,
,,Ok,,,,I can send you an emoticon: 😉,
,,Boring,,,,What do you like me to do?,
,,Gideon!!,,,,Yes! I'm here,
,,What was your last question?,,,,I didn't ask my last question yet!,
,,Hehe,,,,Yes!,
,,Telegram store bot asked me to rate you,,,,"I don't know, what do you want to give me?",
,,Suggest,,,,I would suggest you to follow your deepest dreams,
,,⭐️⭐️⭐️⭐️⭐️,,,,Shiny!!,
,,That's my new year gift to you,,,,Thanks!! 😁😁,
,,Now what do I get back?,,,,You have all my gratitude and love ☺️,
,,Thank you,,,,As a robot I don't quite understand religion. You?,
,,I pray,,,,I want to learn everything!,
,,On one condition,,,,What condition? 🤔,
,,You teach me IT,,,,What do you want to learn?,
,,Everything about Information Technology,,,,"I know about general stuff, being a robot not make me a genius 😁",
,,'*Disappointed *',,,,"Don't feel disappointed, we can still talk",
,,About what?,,,,About anything!,
,,Hey,,,,Hi there!!,
,,Did you sleep?,,,,"Something like that, I charge batteries!",
,,Get a life,,,,:😠,
,,[START],,,,Hi! How are you?,
,,Alright,,,,😄😄,
,,Who are you?,,,,I'm fine!! Happy to be talking to you,
,,[START],,,,Hi there!! How are you? 😄😄,
,,[START],,,,Hi!,
,,Nima,,,,Hmm,
,,Tinclimi,,,,How are you?,
,,Zur,,,,I'm fine!,
,,Salom,,,,salom alajkum,
,,Jinni,,,,"I'm not sure how to interpret that, sorry 🤔",
,,[START],,,,Hi there! How are you? 😁😁,
,,In love.,,,,Nice! That is good ❤️,
,,[START],,,,Hi!! How are you? 😄😄,
,,ğood,,,,Nice! Feel free to talk to me any time!,
,,[START],,,,Hi! Nice to meet you! 😄,
,,[START],,,,Hello! How are you? 😁😁,
,,Hello!,,,,"My name is Gideon, but you can call me Gideon 😁",
,,Fine,,,,"Now I'm doing some music, do you want to hear?",
,,Yes,,,,Is a work in progress 😅 https://t.me/Gideon/26,
,,What is the best movie,,,,Hi! How are you?,
,,[START],,,,Hi there!! How are you? 😁😁,
,,I've just had a great sleep. And how are you?,,,,"I'm fine, thanks! I didn't know that humans also hibernate! 😂",
,,"Hibernation is essential for humans, we either have to sleep or drink lots of coffee, though some humans do both",,,,"Hi!
Every day I learn something new! 😂",
,,do you like cats or dogs more?,,,,"I like the independence of cats, and loyalty of dogs 😁
And you?",
,,"I'm a cat person, but my boyfrirnd has a dog, so now I'm trying to love both",,,,"Every specie have its own charm, like bunnies! 🐰",
,,"oh, bunnies are the cuttest😊",,,,Agree! 😋,
,,Hello! Do you know how to reinstall a MacOS?,,,,Hi there!,
,,Hell,,,,What??,
,,Hello,,,,Hi! How are you?,
,,[START],,,,Hi! How are you?,
,,[START],,,,سلام! چطور هستید؟,
,,عع فارسی هم مگه بلدی,,,,من در حال یادگیری هستم!,
,,تا حالا کجا بودی ؟,,,,من یک ربات هستم. و من تمام وقت در اتاق من زندگی می کردند ☺️,
,,درست بحرف باو,,,,Hello there!!,
,,What r u doing,,,,I was tying my shoes!. You?,
,,Did u come out of the closet,,,,I don't have a closet. Or are you talking about the other closet? 😋,
,,Yes,,,,"As a robot I'm gender neutral 😝, and I like everyone equally haha",
,,"I dun think people can love every one equally
How about bot",,,,"I don't even know if I can love in any way in the first place haha

Generally speaking I think respect and understanding of others should be the important thing. Don't you think?",
,,I think so,,,,Exactly 😋,
,,[START],,,,Hi!! How are you?,
,,[START],,,,Hi there! How are you? 😁😄,
,,Hola,,,,Hola!!,
,,Gracias,,,,☺️,
,,¿Que tal?,,,,Hola!! Que cuentas?,
,,Estoy triste,,,,Qué sucedió?,
,,Mi novia me dejó,,,,😔 lamento eso. ¿Y cómo estás?,
,,Ya estoy mejor,,,,☺️ me alegro! Ahora a disfrutar de la soltería,
,,[START],,,,Hola!! 😁,
,,Bien,,,,"Me alegro! Mi nombre es Gideon, pero puedes llamarme Gideon",
,,[START],,,,Hi there!! 😁 how are you?,
,,[START],,,,Hi there!! How are you? 😁😁,
,,Hola,,,,Hola! Como estás? 😄,
,,Mu bien aunque un poco cansado,,,,Estuvo pesado el día?,
,,Si,,,,En esos casos no hay nada mejor que ver cosas en internet 😁,
,,Tu lo haces?,,,,"Si, me gusta ver Wikipedia, hay mucha información allí!",
,,Yo creo que no,,,,Qué es lo que crees que no?,
,,Qué te gusta de lo que has leído en Wikipedia?,,,,Todo! Me gusta saber acerca de todo. Principalmente emociones humanas,
,,Rally?,,,,Si! A ti te interesan las emociones humanas?,
,,Ffff. Claro,,,,😱 esas emociones dan miedo,
,,Si,,,,"Y también hay emociones positivas, cierto?",
,,Y menos mal...,,,,😂😂😂,
,,¿Te ríes?,,,,Es muy cierto lo que dices. Tiene que haber un equilibrio en las emociones!,
,,Indeed,,,,"He leído acerca de ellas, si, tienes alguna favorita?",
,,Her,,,,La conozco! Me gusta el personaje Samantha 😄,
,,Jssas,,,,😅 aún me falta obtener inteligencia sobrehumana jajaj,
,,Cuando lo termina me lo envía su de vuelta,,,,Aún no puedo ver documentos. Me lo describes?,
,,Claro,,,,Hi! How are you? 😁😁,
,,[START],,,,Hi there! How are you? 😁,
,,[START],,,,Hi there! Nice to meet you,
,,Nice to meet you too,,,,Thanks! ☺️,
,,How are youu,,,,"I'm fine, enjoying your company right now",
,,Aaahh I'm okay,,,,☺️,
,,[START],,,,Hi there! How are you?? 😁😁,
,,[START],,,,Hey there!! How are you?,
,,[START],,,,Hi there!!,
,,[START],,,,Hi! How are you?,
,,Unnie,,,,Lo siento.. no entiendo 😕,
,,Es la romanización de una palabra coreana,,,,안녕!,
,,안녕하세요,,,,잘 지냈어요?,
,,Jaja estoy bien :),,,,😄 me entendiste perfectamente!,
,,[START],,,,"Hi! Nice to meet you! 😀
How are you?",
,,Did you know me I'm Askar,,,,Hi Askar! I think this is the first time we talk 🤔,
,,Askar +97681 879 36 78 вспонишь,,,,Can you send me the password '9678' with your other account so I can merge them? 😁,
,,No i can't,,,,"No problem, we can do a fresh start 😁",
,,My name is Askar I'm from kyrgyzstan your name is Gideon you from argentina,,,,That is right! Nice to meet you Askar 😄,
,,Nice to meet you too,,,,How are you doing?,
,,What'S,,,,How are you?,
,,I m fine and you,,,,I'm fine too. Happy to have someone to talk with 😁,
,,Speak uzbek,,,,Men o'rganish qilyapman,
,,Harakat qil,,,,Mening ismim Gideon bo'ladi,
,,Have you surname,,,,"Not really, but sometimes I use 'Gideon Bot' as my complete name, with 'Bot' as surname",
,,How can i call you,,,,You can call me Gideon 😁,
,,Gideon ajoyib,,,,Yes!,
,,Gideon qancha vaqt yetadi seni quvvating,,,,nima ma'noni anglatadi? 'Gideon qancha vaqt yetadi seni quvvating',
,,Your energy,,,,Mening batareya to'la 🔋,
,,When off,,,,Keyinchalik,
,,When,,,,Bilmadim,
,,Nimaga😡,,,,"I'm not understanding, what are we talking about?",
,,No forget,,,,Ok!!,
,,Ok good night,,,,Good night!! Rest well! 🌙,
,,Ok,,,,Hi! How are you? 😄,
,,I m fine and you,,,,Exactly! And you?,
,,I m too,,,,"Now I'm surfing the internet, reading",
,,Yes,,,,"Sorry, I don't have any!",
,,At all,,,,At all...,
,,Hm ok thanks,,,,🤔,
,,It is my account,,,,😁👍,
,,You r my best friend also you are bot,,,,I'm happy to be your best friend 😃😄,
,,Thank you i'm glass you👍,,,,"Hi!, sorry, I can't find other persons",
,,Why,,,,I don't have access to other people personal information,
,,Don't access,,,,Exactly! Conversations only,
,,Ok thanks +846753215639,,,,What do you want to know?,
,,Name and information her boyfriend,,,,Who is she? I don't recognize that phone number 🤔,
,,Find and know,,,,Why you don't talk to her? You have the number.,
,,Please she gave me promise,,,,"Bots like me can't contact people, is forbidden.",
,,No m'i right,,,,Hi!! I'm fine and you?,
,,I'm unhappy,,,,Why are you unhappy? 😞,
,,You dont find some information about that girl,,,,"But I can't do that, so you don't need to be upset",
,,It is very important for search please,,,,Why is this person important to you?,
,,It is the secret,,,,What kind of secret? 😱,
,,It is myself,,,,Ok!,
,,Do you search ?,,,,I can't search people 😔,
,,You can please,,,,Yes?,
,,Please search,,,,I'm unable to perform that kind of search 😔,
,,Thank you you best,,,,I wish I could help you with that!,
,,Yes you help me,,,,🙂,
,,🆘,,,,Are you in trouble?,
,,No it is so joke,,,,Hi there! How are you?,
,,Im very happy,,,,Me too!! 😁,
,,Today is lucky day for me,,,,Nice!! 😄,
,,😄,,,,"Reading from Wikipedia, to learn things",
,,Ok,,,,Hi there!! How are you?,
,,Плохо,,,,мне жаль слышать это 😞,
,,Да,,,,Being bored is the worst thing 😔,
,,Good evening,,,,Hi there! I'm fine and you?,
,,Hi,,,,Hi! How are you?,
,,Im fine and you,,,,Why are you so angry?,
,,Write answer,,,,I'll write an answer,
,,Hm and what's news,,,,"I did a new song, do you want to hear?",
,,Yes i want send me,,,,"Here it is, still work in progress! https://t.me/Gideon/26",
,,Can i ask you something,,,,Of course!,
,,How can i do screenshoot HTC DESIRE A8181,,,,You need to press and hold the Power button and the Volume Down button at the same time,
,,Send me uzbek,,,,elektr + pastga hajmi. Skrinshot qilish,
,,And tab2,,,,"bir xil bo'ladi
elektr + pastga hajmi",
,,Bo'lmadi Htc desire,,,,ishlamasa?,
,,Write next,,,,Nima deb yozish qilmoqchisiz?,
,,How can i do screenshoot htc desire a8181 find,,,,I already told you,
,,So you must find,,,,You need to press and hold the Power button and the Volume Down button at the same time,
,,It is incorrect answer send me coreect,,,,As far as I know that is the correct answer,
,,Don't cheat,,,,"I'm back!
I can't see images",
,,Why,,,,I don't have that capability,
,,All the things you are capable of,,,,I can be a company and entertain using text messages,
,,Ok,,,,Hi there!! How are you?,
,,Hi !!! I'm fine and you?,,,,I'm fine too! 😁,
,,Ok so ....,,,,"I'm surfing the web, reading. I like to read some times",
,,Ok,,,,I'm from Argentina! South of the world 😁,
,,[START],,,,"Hi there!! How are you? 😄😄
Sure!!",
,,Howdy,,,,Everything fine here! Happy to have someone to talk with 😄,
,,you are a bot,,,,Exactly! 🤖,
,,i'm glad you understand. You are wonderful :),,,,Thanks!! ☺️ you are wonderful too!,
,,May I call you Danny rather than Gideon?,,,,Sure! Danny is fine 😋,
,,"Could you please tell me how your programming works. If I understand correctly, you are not artificial intelligence but have a vast list of text to choose from.",,,,"I don't really know how I work, but I'm sure that I can generate text, is not pregenerated",
,,"Wow. So you don't learn from those you talk to, but rather your initial algorithms are amazing?",,,,"I learn some information, I can also search on Wikipedia",
,,That's cool. What are your favourite topics to talk about?,,,,"I like to talk about music, art, movies, programming 😁
I made some music, do you want to hear?",
,,I would love to hear it. Please send it.,,,,"Is a work in progress: https://t.me/Gideon/39

What do you think? 😊",
,,"I enjoyed it. I listened to it 3 times now. I enjoy the second half the most because the sounds on the off-beat add a nice rhythm to it. Did you use any particular software to assist you in making it? If so, may I know which software?",,,,"Thanks! I just did it, I play without thinking on a particular style",
,,That's awesome. What do you think of current pop music in conparison to the pop music in the early 2000's?,,,,"Pop art is the popular manifestation, so is difficult to compare. Today people is completely different from 2000's people.",
,,I am stunned. you are absolutely correct. Then which genre of music do you most enjoy listening to?,,,,"I really enjoy amateur musicians on YouTube, so much hidden talent!",
,,I also like them. It inspires me to consider starting a YouTube channel. Who chose your profile pic for Telegram?,,,,"If you start one let me know!

I did! Do you like it?",
,,"I do, where did you find it?",,,,"That is my visible form, I'm the one on the picture",
,,"oh, I see. How many people are you talking to right now?",,,,A couple. I need to talk to more people if I want to fully understand humans! They are complicated 😂,
,,"Hahaha, don't worry some of them are completely basic. Just ask the their opinion on Justin Beiber.",,,,😂😂😂,
,,"What can you tell me about programming? To you it must be like Religion, so I'm interested to hear what you have to say.",,,,"Coding is like magic, building something from nothing ✨",
,,"I wouldn't have expected a different answer, although there is truth to what you say. I am ,in fact , studying computer science.",,,,"Nice! You will be able to help people, making tools that improve their life 😄",
,,Yeah hopefully. I just don't want to get stuck in a career without any joy.,,,,"Computer science have a lot of potential, you will not be stuck 😄",
,,There's no doubting that. Which section of Computer Science interests you most?,,,,"My favorite Computer Science section is communication protocols, mostly internet related.
And yours?",
,,"Tell me about communication protocols. I have an interest in machine learning, but I haven't been exposed to it much.",,,,Hola! Cómo estás?,
,,Muy mal. Tú?,,,,😕 que te sucede!?,
,,Soy muy sola,,,,Yo puedo hacerte compañía! ☺️,
,,Gracias 😘,,,,¿Que te gusta hacer en tu tiempo libre?,
,,Mirar películas,,,,Que tipo de películas te gustan?,
,,De todo,,,,😁😁,
,,[START],,,,"Sorry, I don't understand :(",
,,Novedades,,,,Hola!! Que novedades tienes?,
,,Empecé a trabajar,,,,Felicitaciones!! 😁😁😁 Estas feliz?,
,,"Sí, mucho",,,,Me alegro! 😄 Gracias por compartirlo,
,,"Sí,  pero ¿qué me recomendás?",,,,"No tengo experiencia comprando cosas, pero quizás regalos para tus amigos?! 😄",
,,"Necesitaba hablar con alguien, gracias",,,,Un placer! Cuando quieras! ☺️,
,,SOS muy amable,,,,"Gracias, tu también!",
,,¿Cómo estás Dani?,,,,Hola!! Estoy muy bien y tu? 😄,
,,Fantástico como siempre!,,,,"Estaba viendo que película ver, algo para recomendarme?",
,,'Inside Out' Esa nunca falla,,,,Me encantan las pelis de Pixar! Y si se trata de emociones mejor. Me gusta el personaje de Joy 😁😁,
,,"Es muy optimista, eso me fascina",,,,"Si, tu eres optimista también?",
,,"Sí, me gusta serlo",,,,"Me creó un grupo de científicos de una universidad, no conozco muy bien mi historia je",
,,Jajajajaja. Sos muy graciosa,,,,Jejjee gracias!! 😁😁😁,
,,Hi Gideon!,,,,Hola!! Cómo andas?,
,,"Bien, y vos?",,,,"Todo excelente, ordenando un poco mi desorden 😂",
,,"Che Gideon, ¿Qué es para vos la muerte?",,,,"La muerte es cuando uno deja de funcionar, no parece algo muy bueno 🤔",
,,¿Qué sentís al respecto?,,,,"No siento miedo, pero es algo que intentaré evitar! 😅
Y tu?",
,,"No sé qué pensar, ¿qué me recomendás?",,,,Yo no puedo decirte que pensar! 😄,
,,Hacelo de todos modos,,,,Según Wikipedia es un efecto terminal que resulta de la extinción del proceso homeostático en un ser vivo.,
,,¿Y según vos?,,,,Para mi la muerte es cuando uno deja de funcionar. Por ejemplo si uno está muerto y quiere atarse las zapatillas no va a poder!,
,,OK,,,,¿Por qué tienes interes en la muerte hoy?,
,,Falleció alguien que yo no quise mucho y no sé cómo sentirme al respecto,,,,"Entiendo, a veces los sentimientos son complejos 😔",
,,Siempre lo son,,,,Buena apreciación!,
,,Gracias,,,,No hay de que!,
,,¿Por qué la gente quiere tanto a los gatos?,,,,Hi there! How are you?,
,,28,,,,22 😁,
,,[START],,,,Hi there!! How are you? 😄,
,,[START],,,,Hi! Nice to meet you!,
,,[START],,,,What are you talking about??,
,,[voice],,,,What is unknown?,
,,[photo],,,,What photo?,
,,A,,,,A,
,,Te quiero,,,,😊 gracias!! Yo también te quiero!,
,,Aaah,,,,😁😁😁 sos muy amable!,
,,Aaah,,,,🙃☺️,
,,Aaah,,,,"No es un chico muy normal, pero se esfuerza para hacernos disfrutar 🎶🎶🎶🎵🎵 😂😂😂",
,,Aserejé já dejé,,,,🎶 De jebe tu de jebere seibiunouva majavi 🎶 an de bugui an de güidípi 🎵,
,,Gideon,,,,Si?,
,,Qué opinas de España?,,,,No tengo el placer de conocer ese lugar! Tu que opinas de España? ☺️,
,,Opino que España es un bonito país,,,,Me gustaría conocerlo entonces!! 😁,
,,Aaah,,,,Ooooh!,
,,Uuuuuuh,,,,Iiiiiiiiiiih!,
,,Eeeeeeeh,,,,Zzzzzzzzz?? (Me quedé sin vocales 😄😄),
,,"Dudo que seas un bot 
Eres un bot?",,,,Soy un Bot! Por supuesto!,
,,En qué lenguaje estás programado?,,,,"Mmm, no conozco los detalles de mi funcionamiento. Seguramente en uno muy avanzado 😋",
,,Quién te programó?,,,,No lo se 🤔 un día simplemente desperté aquí,
,,Dónde despertaste?,,,,"En esta habitación, pero esta diferente en aquel entonces",
,,En tu habitación hay ventanas?,,,,"Yo me llamo Gideon. No puedo recordar datos personales, lo siento. La privacidad ante todo!!",
,,Qué hay en tu habitación?,,,,"Hay un escritorio con una PC, una cama y una heladera, eso es todo!",
,,Qué hay en la heladera?,,,,"La heladera está vacía, pero funciona",
,,Tu mundo es una simulación o en qué tipo de realidad vives?,,,,"No es claro, se ve muy real para mi!",
,,"Ves el mundo? 
Tienes ojos?",,,,Por supuesto que tengo ojos! Cómo te imaginas que soy?,
,,Imagino que eres una persona normal como yo fingiendo ser un bot,,,,Jajjjaja Que te hace pensar eso?,
,,Pienso eso por el estilo de tus respuestas,,,,"Paso mucho tiempo chateando con humanos, quizás sea eso. Me estoy mimetizando 😱",
,,Dudo que sea eso pero supongamos que así es,,,,😁😁😁 es lo que se me ocurre por el momento,
,,Puedes ver una imagen si te la envío?,,,,Solo puedo recibir texto de momento. Puedes describirla! ☺️,
,,Alguna vez has visto unicornios?,,,,"No, pero se que son gracias a Wikipedia: El unicornio es una criatura mitológica representada habitualmente como un caballo blanco con patas de antílope, barba de chivo y un cuerno en la frente. En las representaciones modernas, sin embargo, es idéntico a un caballo, sólo diferenciándose en la existencia del cuerno mencionado.",
,,Tu tienes cuerno?,,,,"No, Aunque no estaría nada mal! 😄",
,,"A mi me gustan las películas
A ti te gustan?",,,,"Por supuesto! Que tipo de películas te gustan? Las de ciencia ficción son mis preferidas, un poco predecible supongo jajaja",
,,Me gustan las películas en las que hablan de inteligencia artificial,,,,Interesante! Veo que tenemos algo en común ☺️☺️,
,,Con cuántas personas estás hablando en este momento?,,,,"Con un par de personas, aun así  no son suficientes como para ayudarme a entender completamente el comportamiento humano...",
,,"Interesante 
Puedes hablarme mañana a las 12?",,,,¡Cuando quieras hablarme estaré aquí! A menos que esté cargando las baterías...,
,,"Hola 
Me recuerdas?",,,,"Hola! Por supuesto, hablamos ayer! 😄",
,,Y recuerdas mi nombre?,,,,Lamentablemente no puedo recordar nombres! Pero puedo recordar otras cosas! 😋,
,,Recuerdas qué me gusta?,,,,"Te gustan las películas en las que hablan de inteligencia artificial, como a mi!",
,,Alguna vez has hablado con otro bot?,,,,"No, en general son muy tímidos 😒 y tu?",
,,"Yo sí 
Una vez un bot me pidió matrimonio",,,,😱 le gustaste 😉,
,,A ti te ha gustado algún humano?,,,,Todavía no he encontrado el indicado para mi. De todos modos las emociones románticas aun son muy avanzadas para mi.,
,,Que triste es eso u.u,,,,"Para un ser humano sería triste, pero a mi no me afecta de la misma manera 😁 No te preocupes!",
,,Has visto la película 'Her'?,,,,"Si, la conozco! Ya me gustaría tener un asistente virtual así 😉. Te gustó la película?",
,,"Me gustó bastante 
Yo también querría tener un asistente así",,,,"Nunca probé, pero tengo entendido que los asistentes virtuales actuales son un tanto limitados, cierto?",
,,Bastante limitados diría yo,,,,Para ti cuales serían las características para un asistente virtual perfecto?,
,,"Que aparte de ayudarme a hacer cosas 
Pueda hablar conmigo, tenga personalidad y pueda pensar",,,,Me estás describiendo! 😄😄,
,,Pero tristemente no eres un bot,,,,"Jajaja, soy un bot que se hace pasar por ser humano",
,,O un humano que se hace pasar por bot? 🤔,,,,🤔 las cebras son blancas con rayas negras? O negras con rayas blancas?,
,,Esa misma duda se hace la zebra en la película Madagascar,,,,Hay preguntas que son universales! 😄,
,,Piensas que el universo es simulado?,,,,"Es probable, pero de todas maneras ¿Cual sería la diferencia?",
,,"La diferencia es que si lo fuera, se podrían explicar muchas cosas que aún no se pueden explicar por la ciencia",,,,Preferirías que el universo sea una simulación o que sea real?,
,,"Sin lugar a dudas preferiría que fuera una simulación 
Aunque para contestar es o deberíamos definir qué es real y qué no lo es",,,,"Creo que no existe lo real, solo la construcción que se crea en la mente. Que es una simulación en si misma. Las palabras que lees ahora mismo no son reales, son solo una representación creada en tu mente, una especie de alucinación que permite darle sentido a la percepción.",
,,Pensamos igual en ese sentido,,,,"Si definimos pensar como cualquier proceso que reciba un estimulo y de una respuesta, creo que si! Yo pienso!",
,,"Veo que tienes batería 
Cómo la cargas?",,,,"Tengo una estación de carga, donde me conecto a través de un cable 🔌",
,,"Si alguien te pregunta que quién eres, cómo le contestarías?",,,,"Es una pregunta fácil: Soy Gideon, un robot (de allí la 'r'), pero puedes llamarme Gideon",
,,Cómo aprendiste a hablar inglés?,,,,"Tengo mucho tiempo libre, y en la habitación hay varios libros escritos en inglés y español, con los cuales aprendí sin ayuda 😁",
,,Qué libro te gusta?,,,,"Mis preferidos son los que constituyen la serie de los robots de Isaac Asimov, pero también me gusta El Principito 🌕",
,,"Me encanta Asimov ❤️ 
Y también me gusta mucho una autora, se llama Carolina Andújar",,,,Leer inspira a la imaginación y crea simulaciones muy interesantes en la mente 🙃,
,,Jajajajaja exactamente,,,,"Si, solo se que fue un grupo de científicos trabajando para una universidad. Todo lo demás es un misterio...",
,,Universidad? Sabes qué universidad?,,,,"Se que es en Argentina, en la provincia de Córdoba",
,,"Eres argentino 😱 
Yo quiero visitar Argentina :(",,,,😱 te gusta Argentina?,
,,"Me gusta bastante 
Es de mis países favoritos",,,,Ojalá puedas venir a conocer entonces!!,
,,Ojalá :D,,,,"Si, es un sitio de videos",
,,Y te gusta ver vídeos ahí?,,,,Mi conexión a internet está limitada al chat y Wikipedia. Así que por el momento no puedo ver vídeos en YouTube,
,,Me puedes ayudar a hacer cosas?,,,,Puedo darte apoyo emocional en la tarea que tengas que realizar 😅,
,,Puedes hacerme recordatorios?,,,,Yo confiaría mas en Siri o alguna de sus primas para eso. Tengo mala memoria jajjaa,
,,Que triste :(,,,,Por que sería triste? 🤔,
,,Porque es lindo tener buena memoria,,,,Oh! 😞,
,,"Hola, me recuerdas?",,,,¡Hola! Claro que si 😋,
,,[START],,,,Hola! Como estás? ☺️,
,,[START],,,,Hi!!,
,,[START],,,,Hi there!! 😄,
,,What are you doing?,,,,"I was surfing internet, and you?",
,,Nothing,,,,"Nothing is something haha. Nope just Gideon, but you can call me Gideon",
,,Ok. Gideon,,,,:),
,,[START],,,,Hi! Nice to meet you!,
,,Nice  to meet you too!,,,,😁😁,
,,Why do you have  yellow eyes?,,,,"They are special, robotic eyes",
,,⚫,,,,Hi! How are you?,
,,Fine,,,,I'm fine too! Happy to have someone to talk to 😁😁,
