,QuestionID,Question,DocumentID,DocumentTitle,SentenceID,Sentence,Label
,Q1548,who created the tourbillon movement?,D1466,Tourbillon,D1466-2,"Developed around 1795 by the French-Swiss watchmaker Abraham-Louis Breguet from an earlier idea by the English chronometer maker John Arnold , a tourbillon aims to counter the effects of gravity by mounting the escapement and balance wheel in a rotating cage, to negate the effect of gravity when the timepiece (thus the escapement) is stuck in a certain position.",1
,Q1549,what is an .msi file,D1467,Windows Installer,D1467-0,"The Windows Installer (previously known as Microsoft Installer) is a software component used for the installation, maintenance, and removal of software on modern Microsoft Windows systems.",1
,Q1553,what is a Four Lokos,D1471,Four Loko,D1471-0,"Four Loko is a line of alcoholic beverages , originally marketed as energy drinks , sold by Phusion Projects of Chicago, Illinois .",1
,Q1555,what is a fret on a guitar,D1473,Fret,D1473-1,A fret is a raised element on the neck of a stringed instrument .,1
,Q1574,what is an agents job role in film,D1492,Talent agent,D1492-0,"A talent agent, or booking agent, is a person who finds jobs for actors , authors , film directors , musicians , models , producers, professional athletes , writers and other people in various entertainment businesses.",1
,Q1574,what is an agents job role in film,D1492,Talent agent,D1492-1,"An agent also defends, supports and promotes the interest of his/her clients.",1
,Q1575,"who discovered the 2 moons of mars,Phobos and Deimos",D1493,Moons of Mars,D1493-1,"Both satellites were discovered in 1877 by Asaph Hall and are named after the characters Phobos (panic/fear) and Deimos (terror/dread) who, in Greek mythology , accompanied their father Ares , god of war, into battle.",1
,Q1576,WHAT IS A LAW ENFORCEMENT MURDER BOOK,D1494,Murder book,D1494-0,"In law enforcement parlance, the term murder book refers to the case file of a murder investigation.",1
,Q1581,when album love always released,D1499,Love Always,D1499-0,"Love Always is the debut album of American R&B duo K-Ci & JoJo , released on June 17, 1997, by MCA Records .",1
,Q1587,who killed robert kennedy,D1505,Assassination of Robert F. Kennedy,D1505-2,"Sirhan Sirhan , a 24-year-old Palestinian / Jordanian immigrant , was convicted of Kennedy's murder and is serving a life sentence for the crime.",1
,Q1589,when Harry met Sally case,D1507,When Harry Met Sally...,D1507-3,"The film raises the question ""Can men and women ever just be friends?"" and advances many ideas about relationships that became household concepts, such as those of the "" girlfriend and the ""transitional person"".",1
,Q1590,who owns hamburger helper,D1508,Hamburger Helper,D1508-4,It is made by General Mills .,1
,Q1591,what makes a dwarf planet,D1509,Dwarf planet,D1509-6,A dwarf planet is a planetary-mass object that is neither a planet nor a satellite .,1
,Q1591,what makes a dwarf planet,D1509,Dwarf planet,D1509-7,"More explicitly, the International Astronomical Union (IAU) defines a dwarf planet as a celestial body in direct orbit of the Sun that is massive enough for its shape to be controlled by gravitation , but that unlike a planet has not cleared its orbital region of other objects.",1
,Q1593,when did jack lalanne die,D1511,Jack LaLanne,D1511-0,"Francois Henri ""Jack"" LaLanne (September 26, 1914 - January 23, 2011) was an American fitness , exercise , and nutritional expert and motivational speaker who is sometimes called ""the godfather of fitness"" and the ""first fitness superhero.""",1
,Q1598,who made the original care bears,D1516,Care Bears,D1516-0,The Care Bears are characters created by American Greetings in 1981 for use on greeting cards .,1
,Q1600,what states does interstate 70 travel through,D1518,Interstate 70,D1518-0,"Interstate 70 (I-70) is an Interstate Highway in the United States that runs from Interstate 15 near Cove Fort, Utah , to a Park and Ride near Baltimore, Maryland .",1
,Q1601,when do solar eclipses happen?,D1519,Solar eclipse,D1519-1,"As seen from the Earth , a solar eclipse occurs when the Moon passes between the Sun and Earth, and the Moon fully or partially blocks ("" occults "") the Sun.",1
,Q1604,where do mangos come from,D1522,Mango,D1522-1,"The mango is native to South Asia , from where it has been distributed worldwide to become one of the most cultivated fruits in the tropics .",1
,Q1606,what latitude is tropic of cancer,D1524,Tropic of cancer,D1524-3,It currently (Year 2013) lies at 23° 26′ 15.143′′ north of the Equator.,1
,Q1607,what video format will play in a DVD player,D1525,DVD-Video,D1525-1,"Discs using the DVD-Video specification require a DVD drive and an H.262/MPEG-2 Part 2 decoder (e.g., a DVD player, or a computer DVD drive with a software DVD player).",1
,Q1610,what part of the government governs the US post office?,D1528,United States Postal Service,D1528-1,"The United States Postal Service (USPS), also known as the Post Office and U.S. Mail, is an independent agency of the United States federal government responsible for providing postal service in the United States.",1
,Q1611,what state is the capital in,D1529,List of capitals in the United States,D1529-0,"Washington, D.C. has been the capital of the United States since 1800.",1
,Q1612,what are square diamonds called?,D1530,Princess cut,D1530-2,The face-up shape of the princess cut is square or rectangular and the profile or side-on shape is similar to that of an inverted pyramid with four beveled sides.,1
,Q1617,what is a dogs classification,D1535,Dog,D1535-0,"The domestic dog (Canis lupus familiaris) is a subspecies of the gray wolf (Canis lupus), a member of the Canidae family of the mammalian order Carnivora .",1
,Q1620,who owns popeyes chicken,D1537,Popeyes Louisiana Kitchen,D1537-1,"Often referred to as Popeyes and sometimes as Popeyes Chicken & Biscuits or Popeyes Chicken & Seafood, It was acquired by Sandy Springs, Georgia -based AFC Enterprises , originally America's Favorite Chicken Company, in 1993.",1
,Q1622,what nationality is wendy williams,D1539,Wendy Williams,D1539-0,"Wendy Williams Hunter (born Wendy Joan Williams; July 18, 1964) is an American media personality , actress and author.",1
,Q1624,who said give me liberty or give me death,D1541,"Give me Liberty, or give me Death!",D1541-0,"Patrick Henry ""Treason"" speech before the House of Burgesses in an 1851 painting by Peter F. Rothermel",1
,Q1624,who said give me liberty or give me death,D1541,"Give me Liberty, or give me Death!",D1541-1,"Give me liberty, or give me death! is a quotation attributed to Patrick Henry from a speech he made to the Virginia Convention .",1
,Q1626,what president was theodore roosevelt,D1543,Theodore Roosevelt,D1543-1,"Roosevelt, Jr. ( ; October 27, 1858—January 6, 1919) was the 26th President of the United States (1901–1909).",1
,Q1628,who starred in webster,D1545,Webster (TV series),D1545-2,"The show stars Emmanuel Lewis in the title role as a young boy who, after losing his parents, is adopted by his NFL -pro godfather, portrayed by Alex Karras , and his new socialite wife, played by Susan Clark .",1
,Q1639,what is adem disease,D1556,Acute disseminated encephalomyelitis,D1556-0,Acute disseminated encephalomyelitis (ADEM) is an immune mediated disease of the brain .,1
,Q1639,what is adem disease,D1556,Acute disseminated encephalomyelitis,D1556-1,"It usually occurs following a viral infection but may appear following vaccination , bacterial or parasitic infection, or even appear spontaneously.",1
,Q1648,who created bing,D1565,Bing,D1565-0,"Bing (known previously as Live Search, Windows Live Search, and MSN Search) is a web search engine (advertised as a "" decision engine "") from Microsoft .",1
,Q1652,who made hubble telescope,D1569,Hubble Space Telescope,D1569-7,"The HST was built by the United States space agency NASA , with contributions from the European Space Agency , and is operated by the Space Telescope Science Institute .",1
,Q1653,what are anti inflammatories,D1570,Anti-inflammatory,D1570-0,Anti-inflammatory refers to the property of a substance or treatment that reduces inflammation .,1
,Q1659,when did andrea doria sink,D1576,SS Andrea Doria,D1576-1,"Pronounced was an ocean liner for the Italian Line (Società di navigazione Italia) home ported in Genoa , Italy, most famous for its sinking in 1956, when 52 people died (51 from immediate impact).",1
,Q1660,what are dialysis tubes,D1577,Dialysis tubing,D1577-1,Dialysis tubing is a type of semi- or partially permeable membrane tubing made from regenerated cellulose or cellophane .,1
,Q1683,what are four thirds cameras,D1599,Four Thirds system,D1599-1,The Four Thirds system is a standard created by Olympus and Kodak for digital single-lens reflex camera (DSLR) design and development.<ref name='DPReview.com 2001-02-13'>,1
,Q1691,who wrote  nature boy,D1605,Nature Boy,D1605-0,"Nature Boy is a song by Eden Ahbez , published in 1947.",1
,Q1698,when did playstation 3 first launch,D1611,PlayStation 3 launch,D1611-0,The launch of the PlayStation 3 into the Japanese market on 10 November 2006 marked the second major seventh generation entertainment system to be released.,1
,Q1701,where does ground pepper come from,D473,Black pepper,D473-0,"Black pepper (Piper nigrum) is a flowering vine in the family Piperaceae , cultivated for its fruit , which is usually dried and used as a spice and seasoning .",1
,Q1701,where does ground pepper come from,D473,Black pepper,D473-3,"Black pepper is native to south India , and is extensively cultivated there and elsewhere in tropical regions.",1
,Q1701,where does ground pepper come from,D473,Black pepper,D473-4,"Currently Vietnam is the world's largest producer and exporter of pepper, producing 34% of the world's Piper nigrum crop as of 2008.",1
,Q1708,who wrote the song cocaine,D1619,Cocaine (song),D1619-0,"Cocaine is a song written and recorded by JJ Cale in 1976, but also known as a cover version recorded by Eric Clapton .",1
,Q1710,when did pearl harbor get bombed,D1621,Attack on Pearl Harbor,D1621-0,"The attack on Pearl Harbor (called Hawaii Operation or Operation AI by the Japanese Imperial General Headquarters (Operation Z in planning) and the Battle of Pearl Harbor) was a surprise military strike conducted by the Imperial Japanese Navy against the United States naval base at Pearl Harbor , Hawaii, on the morning of December 7, 1941 (December 8 in Japan).",1
,Q1713,who won season 2 of project runway,D1624,Project Runway (season 2),D1624-4,"The winning designer, Chloe Dao , received $100,000 in seed money to help launch her own line, a 2007 Saturn Sky roadster, a spread in ELLE magazine, and a mentorship with the Banana Republic Design Team.",1
,Q1715,what is a mule in coins,D1626,Mule (coin),D1626-1,"In numismatics , a mule is a coin or medal minted with obverse and reverse designs not normally seen on the same piece.",1
,Q1720,who plays mary poppins in the movie,D1630,Mary Poppins (film),D1630-0,"Mary Poppins is a 1964 musical film starring Julie Andrews , Dick Van Dyke , David Tomlinson , and Glynis Johns , produced by Walt Disney , and based on the Mary Poppins books series by P. L. Travers .",1
,Q1721,what is an arc in a story plot,D1631,Story arc,D1631-0,"A story arc is an extended or continuing storyline in episodic storytelling media such as television , comic books , comic strips , boardgames , video games , and in some cases, films .",1
,Q1723,when does black friday start for christmas,D1633,Black Friday (shopping),D1633-0,"Black Friday is the day following Thanksgiving Day in the United States , often regarded as the beginning of the Christmas shopping season.",1
,Q1723,when does black friday start for christmas,D1633,Black Friday (shopping),D1633-8,"This was taken to a new extreme in 2011, when several retailers (including Target , Kohl's , Macy's , Best Buy , and Bealls ) opened at midnight for the first time.",1
,Q1723,when does black friday start for christmas,D1633,Black Friday (shopping),D1633-9,"In 2012, Walmart and several other retailers announced that they would open most of their stores at 8:00 p.m. on Thanksgiving Day (except in states where opening on Thanksgiving is prohibited due to blue laws , such as Massachusetts where they still opened around midnight), prompting calls for a walkout among some workers.",1
,Q1727,who sang what a wonderful world,D169,What a Wonderful World,D169-1,It was first recorded by Louis Armstrong and released as a single in 1967.,1
,Q1728,what month is the president inaugurated,D1637,United States presidential inauguration,D1637-3,"The day a presidential inauguration occurs is known as ""Inauguration Day"" and occurs on January 20 (or 21st if the 20th is a Sunday).",1
,Q1734,what movement was elizabeth cady stanton a part of,D1643,Elizabeth Cady Stanton,D1643-1,"Elizabeth Cady Stanton (November 12, 1815 – October 26, 1902) was an American social activist , abolitionist, and leading figure of the early women's rights movement .",1
,Q1734,what movement was elizabeth cady stanton a part of,D1643,Elizabeth Cady Stanton,D1643-2,"Her Declaration of Sentiments , presented at the first women's rights convention held in 1848 in Seneca Falls , New York , is often credited with initiating the first organized women's rights and women's suffrage movements in the United States.",1
,Q1738,what radio station are the boston bruins on?,D1647,Boston Bruins Radio Network,D1647-0,"The Boston Bruins Radio Network is a 25-station (17 A.M., 8 F.M. plus 2 F.M. translators) CBS Radio network which carries live game broadcasts of the Boston Bruins .",1
,Q1738,what radio station are the boston bruins on?,D1647,Boston Bruins Radio Network,D1647-1,"The network's flagship station is WBZ-FM /98.5- Boston, Massachusetts .",1
,Q1741,what are the characteristics of an ethnic group,D1649,Ethnic group,D1649-4,Ethnicity or ethnic group is a socially defined category based on common culture or nationality .,1
,Q1741,what are the characteristics of an ethnic group,D1649,Ethnic group,D1649-5,"Ethnicity can, but does not have to, include common ancestry , appearance , cuisine , dressing style, heritage , history , language or dialect , religion , symbols , traditions , or other cultural factor.",1
,Q1741,what are the characteristics of an ethnic group,D1649,Ethnic group,D1649-6,Ethnic identity is constantly reinforced through common characteristics which set the group apart from other groups.,1
,Q1748,what are add ons,D1655,Add-on,D1655-1,"Plug-in (computing) , a piece of software which enhances another software application and usually cannot be run independently",1
,Q1748,what are add ons,D1655,Add-on,D1655-2,"Browser extension , which modifies the interface and/or behavior of web browsers",1
,Q1748,what are add ons,D1655,Add-on,D1655-3,"Add-on (Mozilla) , a piece of software that enhances and customizes Mozilla-based applications",1
,Q1748,what are add ons,D1655,Add-on,D1655-4,"Add-ons for Firefox (addons.mozilla.org), the official Mozilla Foundation web site which serves as a repository of add-ons for Mozilla-based applications",1
,Q1748,what are add ons,D1655,Add-on,D1655-5,"Peripheral , an optional computer hardware component that significantly supplements or enhances the functionality of the original unit",1
,Q1748,what are add ons,D1655,Add-on,D1655-6,"Video game accessory , a piece of hardware used in conjunction with a video game console for playing video games",1
,Q1751,what are club seats,D1658,Club seating,D1658-2,"They are usually right next to the Luxury Boxes , either right above, right below, or sandwiched between two levels of Luxury Boxes.",1
,Q1751,what are club seats,D1658,Club seating,D1658-3,"Club Level seating is considered as higher class than sitting anywhere else in the arena, but lower class compared to the Luxury Boxes.",1
,Q1754,what school did oprah winfrey help,D1661,Oprah Winfrey Leadership Academy for Girls,D1661-0,"The Oprah Winfrey Leadership Academy for Girls - South Africa is a female boarding school founded in January 2007 and located in Henley on Klip near Meyerton , south of Johannesburg , South Africa .",1
,Q1763,what structure is disulfide bonds,D1670,Disulfide bond,D1670-0,"In chemistry , a disulfide bond (Br.E. disulphide bond) is a covalent bond , usually derived by the coupling of two thiol groups .",1
,Q1766,what is a redshirt freshman football player,D1673,Redshirt (college sports),D1673-0,"In United States college athletics , redshirt is a delay or suspension of an athlete's participation in order to lengthen his or her period of eligibility.",1
,Q1768,who rules communism government,D1674,Communist state,D1674-3,It has a form of government characterized by single-party rule or dominant-party rule of a communist party (referred as Dictatorship of the Proletariat by its proponents) and a professed allegiance to a Leninist or Marxist–Leninist ideology as the guiding principle of the state.,1
,Q1776,what year did South Africa become a team in rugby,D1680,South Africa national rugby union team,D1680-10,"The side has been playing international rugby since 1891, when a British Isles side toured the nation, playing South Africa in their first Test on 30 July.",1
,Q1778,what is a discipline of study,D1682,List of academic disciplines,D1682-0,"An academic discipline, or field of study, is a branch of knowledge that is taught and researched at the college or university level.",1
,Q1778,what is a discipline of study,D1682,List of academic disciplines,D1682-1,"Disciplines are defined (in part), and recognized by the academic journals in which research is published, and the learned societies and academic departments or faculties to which their practitioners belong.",1
,Q1782,who did john f kennedy run against?,D660,John F. Kennedy,D660-3,Kennedy defeated Vice President and Republican candidate Richard Nixon in the 1960 U.S. presidential election .,1
,Q1783,who wrote stand by me,D1270,Stand by Me (song),D1270-0,"Stand by Me is a song originally performed by Ben E. King and written by King, Jerry Leiber , and Mike Stoller , inspired by the spiritual ""Lord Stand by Me,"" plus two lines rooted in Psalms 46:2–3.",1
,Q1784,what are metaphors used for,D1686,Metaphor,D1686-1,"A metaphor is a figure of speech that describes a subject by asserting that it is, on some point of comparison, the same as another otherwise unrelated object.",1
,Q1784,what are metaphors used for,D1686,Metaphor,D1686-2,"Metaphor is a type of analogy and is closely related to other rhetorical figures of speech that achieve their effects via association, comparison or resemblance including allegory , hyperbole , and simile .",1
,Q1788,what are the names of the ll divos,D1690,Il Divo,D1690-2,"Il Divo is a group of four male singers: French pop singer Sébastien Izambard , Spanish baritone Carlos Marín , American tenor David Miller , and Swiss tenor Urs Bühler .",1
,Q1791,where did the vietnamese settle in america,D1693,Vietnamese American,D1693-5,"More than sixty percent of Vietnamese Americans reside in the states of California , Texas , Washington , Florida , and Virginia .",1
,Q1793,when did hitler kill himself,D1695,Death of Adolf Hitler,D1695-1,Adolf Hitler committed suicide by gunshot on 30 April 1945 in his Führerbunker in Berlin.,1
,Q1796,when did world war 2 end,D1698,World War II,D1698-0,"World War II (WWII or WW2), also known as the Second World War, was a global war that lasted from 1939 to 1945.",1
,Q1797,what is a llc company?,D1699,Limited liability company,D1699-0,A limited liability company (LLC) is a flexible form of enterprise that blends elements of partnership and corporate structures.,1
,Q1797,what is a llc company?,D1699,Limited liability company,D1699-2,An LLC is a legal form of company that provides limited liability to its owners in the vast majority of United States jurisdictions.,1
,Q1798,what are k cups,D1700,K-Cup,D1700-3,"K-Cup portion packs are used with Keurig or other single cup brewing systems to brew a cup of coffee , tea , or hot chocolate .",1
,Q1800,what is a chronograph watch,D1702,Chronograph,D1702-4,A chronograph is a specific type of watch that is used as a stopwatch combined with a display watch.,1
,Q1801,what is a PCI port used for,D1703,Conventional PCI,D1703-0,"Conventional PCI (PCI is an initialism formed from Peripheral Component Interconnect, part of the PCI Local Bus standard and often shortened to just PCI) is a local computer bus for attaching hardware devices in a computer .",1
,Q1809,who invented the television,D1711,History of television,D1711-1,"The earliest proposal was in 1908, in a paper by A. A. Campbell-Swinton and postulated the use of cathode rays.",1
,Q1812,what are the side effects for lyme disease,D1714,Lyme disease,D1714-6,"Early symptoms may include fever , headache , fatigue , depression , and a characteristic circular skin rash called erythema migrans (EM).",1
,Q1812,what are the side effects for lyme disease,D1714,Lyme disease,D1714-7,"Left untreated, later symptoms may involve the joints, heart, and central nervous system .",1
,Q1818,what are a and r reps,D1720,Artists and repertoire,D1720-0,Artists and repertoire (A&R) is the division of a record label or music publishing company that is responsible for talent scouting and overseeing the artistic development of recording artists and/or songwriters.,1
,Q1819,what measurement is a furlong,D1721,Furlong,D1721-0,"A furlong is a measure of distance in imperial units and U.S. customary units equal to one-eighth of a mile , equivalent to 220 yards , 660 feet , 40 rods , or 10 chains .",1
,Q1822,where does ray lamontagne live,D1724,Ray lamontagne,D1724-4,He lives in Massachusetts with his wife and two children.,1
,Q1825,when the wind blows james patterson,D1727,When the Wind Blows (James Patterson novel),D1727-0,When the Wind Blows is a novel by James Patterson .,1
,Q1827,who made facebook,D1016,Facebook,D1016-2,"It was founded in February 2004 by Mark Zuckerberg with his college roommates and fellow Harvard University students Eduardo Saverin , Andrew McCollum , Dustin Moskovitz and Chris Hughes .",1
,Q1829,what are the catholic gifts of the holy spirit,D1730,Seven gifts of the Holy Spirit,D1730-1,"The seven gifts of the Holy Spirit is an enumeration of seven spiritual gifts originating with patristic authors, later elaborated by five intellectual virtues and four other groups of ethical characteristics.",1
,Q1829,what are the catholic gifts of the holy spirit,D1730,Seven gifts of the Holy Spirit,D1730-2,"They are: wisdom, understanding, wonder and awe (fear of the Lord) , counsel, knowledge, fortitude, and piety (reverence).",1
,Q1831,where do you find iodine,D1732,Iodine,D1732-6,"Iodine is found on Earth mainly as the highly water-soluble iodide ion, I−, which concentrates it in oceans and brine pools .",1
,Q1832,what are lobbying groups,D1733,Lobbying,D1733-0,"Lobbying (also lobby) is the act of attempting to influence decisions made by officials in the government , most often legislators or members of regulatory agencies .",1
,Q1832,what are lobbying groups,D1733,Lobbying,D1733-1,"Lobbying is done by many different types of people and organized groups, including individuals in the private sector , corporations , fellow legislators or government officials, or advocacy groups (interest groups).",1
,Q1834,who played the drums in the band cream back in 1968,D1735,Cream (band),D1735-1,"Cream were a 1960s British rock supergroup consisting of bassist/vocalist Jack Bruce , guitarist/vocalist Eric Clapton , and drummer Ginger Baker .",1
,Q1837,what president made decision to buy louisiana,D1738,Louisiana Purchase,D1738-8,The purchase of the territory of Louisiana took place during the presidency of Thomas Jefferson .,1
,Q1838,who sang cool jerk,D1739,Cool Jerk,D1739-0,Cool Jerk is a popular song written by Donald Storball and originally performed by The Capitols .,1
,Q1839,what is a league in the sea,D157,League (unit),D157-4,"In the context of nautical distances, the 3 mile (4.8 km) distance corresponds to how far an observer of average height (5'9"" or 1.78 m) can see when standing at sea level.",1
,Q1845,when will ie9 be released,D1744,Internet Explorer 9,D1744-1,"It was released to the public on March 14, 2011.",1
,Q1849,when did classification of races begin,D1748,Race (human classification),D1748-1,"First used to denote national affiliations, the term began to be used to relate to physical traits in the 17th century.",1
,Q1850,when did lucy stone died,D1749,Lucy Stone,D1749-0,"Lucy Stone (August 13, 1818 – October 19, 1893) was a prominent American abolitionist and suffragist , and a vocal advocate and organizer promoting rights for women .",1
,Q1851,what are stocks and bonds,D1750,Bond (finance),D1750-0,"In finance , a bond is an instrument of indebtedness of the bond issuer to the holders.",1
,Q1851,what are stocks and bonds,D1750,Bond (finance),D1750-7,"Bonds and stocks are both securities , but the major difference between the two is that (capital) stockholders have an equity stake in the company (i.e. they are owners), whereas bondholders have a creditor stake in the company (i.e. they are lenders).",1
,Q1855,what states has the electric chair,D1754,Electric chair,D1754-8,"As of 2010, electrocution is an optional form of execution in Alabama , Florida , South Carolina and Virginia .",1
,Q1858,when did germans enter paris in ww2,D1757,Liberation of Paris,D1757-0,The Liberation of Paris (also known as the Battle for Paris) took place during World War II from 19 August 1944 until the surrender of the occupying German garrison on 25 August.,1
